<?xml version="1.0" encoding="UTF-8"?>
<daxploreUploadFileManifest
xmlns:xsi="http://www.w3.org/2001/XMLSchema-instance"
xsi:noNamespaceSchemaLocation="UploadFileManifest.xsd">
	<fileVersion>
		<major>9</major>
		<minor>32</minor>
	</fileVersion>
	<supportedLocales>
		<language-BCP47>en</language-BCP47>
		<language-BCP47>sv</language-BCP47>
	</supportedLocales>
	<defaultLocale>
		<language-BCP47>en</language-BCP47>
	</defaultLocale>
</daxploreUploadFileManifest>
